051983987101,常州百树厨艺酒店用品有限公司,,无法匹配
051982792958,金坛鞋麦有限公司,,无法匹配
051983700307,分拣部,,无法匹配
051212345678,宽窄巷子成都串串香,,无法匹配
051253940008,太仓震轩文化传媒有限公司,,无法匹配
051263979405,吴江经济开发区昊达五金加工厂,,无法匹配
051252595429,常熟梓阳大码女装专卖店,,无法匹配
051265576414,苏州吴江华丰木门有限公司,,无法匹配
051266247945,南环桥市场尚堰水产品经营部,,无法匹配
051257921722,交通银行信用卡中心苏州分中心,,无法匹配
051255378316,协鑫集成,,无法匹配
051256922778,张家港安凡居家水星家纺分店,,无法匹配
051268326383,每日优鲜,,无法匹配
051286178363,汇通金融数据服务有限公司,,无法匹配
051266616670,苏州中信银行信用卡,,无法匹配
051269576407,工业园区星之盛汽车用品服务部,,无法匹配
051087458596,宜兴市丁蜀镇方勤平陶艺,,无法匹配
051081127741,JABILGREENPOINT无锡绿点,,无法匹配
051083596589,无锡麦多多房地产营销策划,,无法匹配
051085096983,汇通南北商贸有限公司,,无法匹配
051088703333,红星美凯龙颐达华瑞壁纸专卖店,,无法匹配
051486545809,江苏中海工业有限公司,,无法匹配
051482220910,扬州大润发蒋王店,,无法匹配
057187980169,美妍服饰,,无法匹配
057188002948,交通银行太平洋信用卡中心,,无法匹配
057156396618,杭州余杭区南苑街道空调维修部,,无法匹配
057187216281,交通银行股份公司浙江省分行,,无法匹配
057182757293,广汽商贸,,无法匹配
057181112613,久极科技有限公司,,无法匹配
057128028523,三花先途,,无法匹配
057185183190,老香港纯手工蛋糕店,,无法匹配
057186523255,浏阳蒸菜馆,,无法匹配
057456583465,北仑新联合手机连锁,,无法匹配
057463906086,泰花车业,,无法匹配
057512345678,微初科技,,无法匹配
057588755207,绍兴市戴瑞珠宝,,无法匹配
057586061188,新昌礼泉农贸市场,,无法匹配
051185935268,沃德重工,,无法匹配
051686589108,美吧工作室,,无法匹配
051688876001,爱尚优品精品店,,无法匹配
051683605989,中信银行信用卡中心徐州分中心,,无法匹配
051685109996,徐州市马坡镇王堂小学,,无法匹配
051885416597,交通银行信用卡连云港分中心,,无法匹配
055165805537,中银保险合肥分公司,,无法匹配
055165689626,阿奎利亚学校北区,,无法匹配
055166036533,合肥私唯宁健身房有限公司,,无法匹配
079112345678,科明铜业,,无法匹配
079183706522,罗小姐的店,,无法匹配
043186980093,陆军装甲兵士官学校,,无法匹配
043188982537,工行,,无法匹配
043189217975,兴业银行长春分行,,无法匹配
043181807261,沈阳利达农业集团,,无法匹配
043181051157,房天下,,无法匹配
043181166801,九台农商行惠泽分理处,,无法匹配
043181707989,长春新星宇赢时物业,,无法匹配
043181003502,宝胜集团,,无法匹配
043189259567,泰康人寿保险公司,,无法匹配
043263356511,大华日市,,无法匹配
043262558895,商贸经济示范区新海得保健品,,无法匹配
043269953959,船营妇幼保健计划生育服务中心,,无法匹配
043264641869,华润康乃尔医药物流,,无法匹配
043264668055,金木,,无法匹配
043262831858,化建东部基地安装公司,,无法匹配
045186005890,宾县宾州哈瑞手机专卖店分店,,无法匹配
045151507310,平安人寿保险公司珠江路分公司,,无法匹配
045182716515,哈尔滨鑫盛配件有限公司,,无法匹配
045156661436,乐家装饰商店,,无法匹配
045153235383,杏山镇中心小学,,无法匹配
045153115411,哈尔滨道里区群力韵达快递,,无法匹配
045188873735,长春泰达高科智能有限公司,,无法匹配
045187027080,哈尔滨市鸿腾名烟名酒行,,无法匹配
041184526986,大连市天欣网络,,无法匹配
02886510024,西外三鑫宾馆管理公司,,无法匹配
02885114374,李平传媒有限公司,,无法匹配
02885552695,恒业旺街联通营业厅,,无法匹配
02885136641,恒泰包装有限公司,,无法匹配
02887507547,成都辣么美食品经营部,,无法匹配
02883033124,四川省通讯服务有限公司,,无法匹配
02865025870,四川省旺苍同仁医院,,无法匹配
02886736725,四川明航大厦宾馆有限公司,,无法匹配
02885132664,西南油气田分公司,,无法匹配
02886736725,民航大厦宾馆,,无法匹配
02883472143,成都三瓦窑热电厂,,无法匹配
02827198057,富德生命人寿保险中心支公司,,无法匹配
02884541336,成都金山汽修厂,,无法匹配
02887916275,美丽有约彩妆店,,无法匹配
02867246649,九龙县机关单位成都办事处,,无法匹配
02886536303,中国平安人寿股份保险公司,,无法匹配
02885550812,成都市滴滴打车有限公司,,无法匹配
08273369100,恩阳区市政工程处,,无法匹配
02883092074,成都滕飞鞋材有限公司,,无法匹配
02881140182,四川南充电子工业学校,,无法匹配
02884472856,流经岁月精品酒店,,无法匹配
085122220000,惠邦食粮食水配送中心,,无法匹配
085127917666,遵义市区维意定制家具专卖店,,无法匹配
085128778848,巴斯巴,,无法匹配
085182541746,香港奥莎菲尔生物科技有限公司,,无法匹配
085188417110,观山湖公安分局宾阳派出所,,无法匹配
085184111888,贵州观山湖醉仙楼烤鸭店,,无法匹配
085186624558,鸿源家电,,无法匹配
085185967217,德源宜聚网络科技有限公司,,无法匹配
085185911233,贵阳宏异房地产开发有限公司,,无法匹配
085188207459,交通银行信用卡贵阳分中心,,无法匹配
085186253615,中国平安,,无法匹配
085185214578,贵州兴安达物资贸易有限公司,,无法匹配
087164277986,昆明市官渡区宇香云服饰经营部,,无法匹配
087165222000,FPARTY,,无法匹配
087163533592,昆明市贵凤服饰店,,无法匹配
087163398181,盈江县住房和城乡规划建设局,,无法匹配
087163986018,百姿服装,,无法匹配
087166621388,金星房地产,,无法匹配
037167850999,白领美容院,,无法匹配
037155303402,平安保险郑州分公司,,无法匹配
037155905616,榆林市希伯莱电子科技郑州公司,,无法匹配
037154878643,郑州格力电器有限公司,,无法匹配
037163897673,交通银行信用卡中心,,无法匹配
037181995406,恒大旅游集团,,无法匹配
037155272929,郑州平安行汽车服务公司,,无法匹配
037166593993,依美汇服饰广场,,无法匹配
037156192143,河南省周口市八一路科技城,,无法匹配
037186011180,郑州市公共交通总公司快速公Ｅ,,无法匹配
037155192552,太平洋人寿保险股份有限公司,,无法匹配
037155265279,郑州中环信息咨询有限公司,,无法匹配
037155392286,中牟县老凤祥珠宝有限公司,,无法匹配
037186523255,韩美素颜,,无法匹配
037155850508,登封市塔塔木门有限公司,,无法匹配
037166680928,康美时代,,无法匹配
073184028242,民德茶楼怡清源,,无法匹配
073182736262,九典,,无法匹配
073189715893,美团专送,,无法匹配
073188096609,粤海渔村,,无法匹配
073188403625,长沙新华联国际旅游有限公司,,无法匹配
073188395800,曼巴集团公司,,无法匹配
073185328056,长沙东塘平和堂百货爱莉妃专柜,,无法匹配
073188890226,深圳通联金融网络科技,,无法匹配
073189902537,长沙市鑫福餐饮美团红星站,,无法匹配
076085221072,广东省香山衡器有限公司,,无法匹配
076086223716,德立洁具,,无法匹配
076022605401,东凤爱婴前线健康生活馆,,无法匹配
076087616928,高美五金工艺厂,,无法匹配
037969666688,偃师中城百货有限公司,,无法匹配
037986652536,公安消防大队,,无法匹配
037963301168,洛阳惠凯有限公司,,无法匹配
037963892857,洛阳市数字化监督中心,,无法匹配
037963086666,智龙集团,,无法匹配
031168023388,YH永辉超市北辰店,,无法匹配
031184333375,超越水电,,无法匹配
031166166173,广发银行石家庄信用卡中心,,无法匹配
031189659836,隆兴防水材料有限公司,,无法匹配
031184451579,众美家具城一号店爱舍墙纸,,无法匹配
031189653183,泰康人寿河北分公司电销中心,,无法匹配
031169101633,河北地质环境监测院,,无法匹配
053286637360,平度市实验幼儿园,,无法匹配
053281878869,吉利达车辆配件商场,,无法匹配
053287362179,美团外卖,,无法匹配
053286833160,城阳赵哥庄劳务市场,,无法匹配
053286105863,黄岛区蓉儿化妆品店,,无法匹配
053287220083,向阳市场男孩女孩服装店,,无法匹配
053185588898,山东恒发饰业有限公司,,无法匹配
053185871115,圣农发展有限公司,,无法匹配
053168767793,天顿信息科技有限公司,,无法匹配
053187197770,优购世界商业有限公司,,无法匹配
053187104689,圣农发展有限公司,,无法匹配
053167777795,聚成日用品商业有限公司,,无法匹配
053167759898,乐宾百货有限公司,,无法匹配
053188906663,文天企业管理有限公司,,无法匹配
053182918181,德华食品有限公司,,无法匹配
053185555121,济南永智汽修有限公司,,无法匹配
053167884047,中天装饰有限公司,,无法匹配
053187155532,蓝茵工艺品店,,无法匹配
053181317778,宝利超市,,无法匹配
053182893355,玉成文化传媒有限公司,,无法匹配
053185555121,济南长途运输中心,,无法匹配
053188875552,锦园春农业有限公司,,无法匹配
053189657775,中国石油华北油田济南办事处,,无法匹配
053188235897,科柏高实业有限公司,,无法匹配
053186196988,思诺文体用品有限公司,,无法匹配
053187930909,占杰商贸有限公司,,无法匹配
053187189907,欧亚联营集团股份有限公司,,无法匹配
053181285688,济南长途运输股份有限公司,,无法匹配
053185803037,佳诺机械设备有限公司,,无法匹配
053181615121,交通银行济南信用卡中心,,无法匹配
089836696666,海航日月广场读书郎,,无法匹配
089866803412,海南海澜装饰工程有限公司,,无法匹配
089865203974,海南致贸易有限公司,,无法匹配
089823655372,儋州白马井湖南人家湘菜馆,,无法匹配
089863824954,海南呀喏哒餐饮管理有限公司,,无法匹配
089866734275,辉t龙商行,,无法匹配
075561130588,思摩尔麦克兄弟科技有限公司,,无法匹配
075523718922,深圳空中交通管理站技保部,,无法匹配
075589669838,深圳联懋塑胶有限公司,,无法匹配
075527238966,鼻科,,无法匹配
075583991361,兴业银行信用卡中心深圳分中心,,无法匹配
075561607848,交通银行太平洋信用卡中心,,无法匹配
075582602122,深圳市拓普牙科,,无法匹配
075529482438,汇丰木器制造厂,,无法匹配
075527688876,深圳金色乐园休闲管理公司,,无法匹配
075585214578,循真科技,,无法匹配
075584657920,深圳市龙岗区朋裕辉,,无法匹配
075586335871,福建开腾有限公司深圳办事处,,无法匹配
075533504431,超人实业,,无法匹配
075568250164,阁品装饰材料,,无法匹配
051386412420,通州区二甲青年商行,,无法匹配
051381123086,轻松汽配经营部,,无法匹配
051387926879,奥妙生活日化批发,,无法匹配
051384205383,大豫镇兵房初级中学,,无法匹配
051380701518,顶固五金驻工业博览城,,无法匹配
057785318885,凤利鞋业,,无法匹配
057768612335,苍南县聚优优健康信息咨询服务,,无法匹配
057762857026,乐清市北白象潘晓春餐饮店,,无法匹配
057768817688,苍南县金乡姐妹文具厂,,无法匹配
057756845523,蔡林兵粮油店经理,,无法匹配
057389973672,交通银行信用卡中心嘉兴分中心,,无法匹配
057382852753,嘉兴市纱缘纺织纱业,,无法匹配
057387291223,鼎路服饰有限责任公司,,无法匹配
052386695959,可利科技,,无法匹配
052386680708,苏常电器,,无法匹配
057688961999,保利碧桂园西江月,,无法匹配
051589718868,阜宁县老凤祥旗舰店,,无法匹配
051583078800,盐城市时光隧道服饰,,无法匹配
057982050272,5173中国网络游戏服务网,,无法匹配
057985872708,美罗国际,,无法匹配
059586620918,卓越鸿昌公司人力资源部,,无法匹配
059522196038,丰泽区广怡茗茶,,无法匹配
059588692520,泉州市石狮市登行者户外,,无法匹配
075725530050,晴海包装器材有限公司,,无法匹配
075729221011,佛山市顺德球进木业有限公司,,无法匹配
075766830983,佛山市华泰人寿保险公司,,无法匹配
075785601161,佛山市伊盾门窗有限公司,,无法匹配
076981781762,欧亚斯毛织厂,,无法匹配
076989613412,中国平安保险金融,,无法匹配
051785804862,清江浦区暖暖服饰经营部,,无法匹配
051786546777,海投生物能源,,无法匹配
051785802220,金湖县丝丽禾工作室,,无法匹配
052782868635,可成科技,,无法匹配
037766282888,富士康,,无法匹配
037767020898,穰东镇鑫宇女装店,,无法匹配
073185158735,贵州吉祥湖南分公司,,无法匹配
073128255328,俊爆牛仔,,无法匹配
073122791733,美琪,,无法匹配
073152635900,湘潭雨湖拆迁事务所,,无法匹配
075582260755,深圳市中勘勘测设计有限公司Ｅ,,无法匹配
037122236817,恒大文化旅游城,,无法匹配
037123262683,阳阳干锅,,无法匹配
